titulo,subtitulo,descricao,temas,data,ano_mes,ano,mes,hora,turno,n_temas,tamanho_texto,n_palavras_titulo,n_relacionadas,url
Xadrez abre edição virtual dos Jogos Escolares de Minas Gerais,"Inscrições seguem abertas para modalidades de basquete e futebol, com prazo até 5 de fevereiro","Começa, nesta terça-feira (29/12), a etapa virtual dos Jogos Escolares de Minas Gerais (e-Jemg), com competições on-line na modalidade xadrez. Ao...","['Social', 'Esportes', 'Educação']",2020-12-29 16:15:00-03:00,2020-12,2020,12,16,Tarde,3,270,10,4,https://www.agenciaminas.mg.gov.br/noticia/xadrez-abre-edicao-virtual-dos-jogos-escolares-de-minas-gerais
Sedese destaca programas e ações para população vulnerável durante pandemia,"Além das ações de transferência de renda, a secretaria atuou na promoção de políticas de direitos humanos, trabalho e emprego, políticas sobre drogas, esportes e assistência social","As ações e programas realizados pelo Governo de Estado para auxiliar pessoas mais vulneráveis de Minas Gerais durante a pandemia foram destacadas,...","['Social', 'Trabalho', 'Esportes', 'Direitos Humanos', 'Coronavírus']",2020-12-18 14:05:00-03:00,2020-12,2020,12,14,Tarde,5,1027,10,4,https://www.agenciaminas.mg.gov.br/noticia/sedese-destaca-programas-e-acoes-para-populacao-vulneravel-durante-pandemia
Estado realiza etapa on-line dos Jogos Escolares de Minas Gerais,"Modalidades virtuais incluem xadrez, Fifa 2020 e NBA 2K20","A Secretaria de Estado de Desenvolvimento Social (Sedese) realiza, até março de 2021, a etapa virtual dos Jogos Escolares de Minas Gerais (e-Jemg),...","['Social', 'Esportes', 'Educação', 'Coronavírus']",2020-12-15 09:40:00-03:00,2020-12,2020,12,9,Manhã,4,219,10,4,https://www.agenciaminas.mg.gov.br/noticia/estado-realiza-etapa-on-line-dos-jogos-escolares-de-minas-gerais
Sedese e Semad apresentam medidas adotadas na pandemia no Assembleia Fiscaliza,Em ambas as áreas ações para enfrentar reflexos da covid-19 foram destaque,"A Secretaria de Estado de Desenvolvimento Social (Sedese) esteve, nessa quarta-feira (25/11), em mais uma edição do Assembleia Fiscaliza, encontro...","['Trabalho', 'Social', 'Meio Ambiente', 'Esportes', 'Direitos Humanos']",2020-11-26 15:35:00-03:00,2020-11,2020,11,15,Tarde,5,1034,11,4,https://www.agenciaminas.mg.gov.br/noticia/sedese-e-semad-apresentam-medidas-adotadas-na-pandemia-no-assembleia-fiscaliza
Jogos Escolares de Minas Gerais em 2020 são cancelados,Retorno da maior competição esportiva-social do Estado dependerá do controle da pandemia de covid-19,"O Governo de Minas Gerais, por meio da Secretaria de Estado de Desenvolvimento Social (Sedese) e da Subsecretaria de Esportes (Subesp), junto à...","['Esportes', 'Educação', 'Coronavírus']",2020-07-28 14:20:00-03:00,2020-07,2020,7,14,Tarde,3,375,9,4,https://www.agenciaminas.mg.gov.br/noticia/jogos-escolares-de-minas-gerais-em-2020-sao-cancelados
Lei Estadual de Incentivo ao Esporte passa por modernização,"Decreto visa aumentar transparência e isonomia, além de integrar mais a sociedade civil","A Lei Estadual de Incentivo ao Esporte de Minas Gerais, que tem a finalidade de fomentar a prática esportiva no estado, passou por algumas...",['Esportes'],2020-06-22 12:45:00-03:00,2020-06,2020,6,12,Tarde,1,466,9,4,https://www.agenciaminas.mg.gov.br/noticia/lei-estadual-de-incentivo-ao-esporte-passa-por-modernizacao
Secretaria de Saúde avalia proposta para retorno do futebol,"Viabilidade será estudada pelas autoridades sanitárias que, no momento, reiteram importância de maior controle e cuidado com a pandemia","Na coletiva virtual desta quarta-feira (17/6), a Secretaria de Estado de Saúde (SES-MG) informou que vai analisar uma proposta da Federação Mineira...","['Saúde', 'Esportes', 'Coronavírus']",2020-06-17 17:07:00-03:00,2020-06,2020,6,17,Tarde,3,834,9,4,https://www.agenciaminas.mg.gov.br/noticia/secretaria-de-saude-avalia-proposta-para-retorno-do-futebol
Estado lança o Mova Minas Recreativo,Iniciativa da Sedese propõe atividades para crianças e adolescentes durante a pandemia,"A exemplo do Mova Minas, criado para incentivar a prática de atividades físicas neste período de isolamento social devido à pandemia de covid-19, a...","['Social', 'Esportes', 'Coronavírus']",2020-06-17 09:07:00-03:00,2020-06,2020,6,9,Manhã,3,490,6,4,https://www.agenciaminas.mg.gov.br/noticia/estado-lanca-o-mova-minas-recreativo
Jogos Escolares de Minas Gerais são adiados,Medida visa proteger jovens atletas do coronavírus,"Em virtude da pandemia do coronavírus (Covid-19), que levou Minas Gerais a decretar situação de emergência, a Secretaria de Estado de...",['Esportes'],2020-03-20 14:15:00-03:00,2020-03,2020,3,14,Tarde,1,251,7,4,https://www.agenciaminas.mg.gov.br/noticia/jogos-escolares-de-minas-gerais-sao-adiados
Jogos Escolares de Minas Gerais chegam à etapa estadual com adesão recorde de 100% dos municípios,"Neste ano, competição acontece em quatro cidades, com mais de 7 mil estudantes-atletas disputando diferentes modalidades","Começou nessa terça-feira (5/8), em Pará de Minas, na região Central, a etapa estadual dos Jogos Escolares de Minas Gerais (Jemg). Pela primeira...","['Social', 'Esportes', 'Educação']",2025-08-06 10:00:00-03:00,2025-08,2025,8,10,Manhã,3,808,16,4,https://www.agenciaminas.mg.gov.br/noticia/jogos-escolares-de-minas-gerais-chegam-a-etapa-estadual-com-adesao-recorde-de-100-dos-municipios
Inscrições para os Jogos Escolares de Minas Gerais estão abertas,Municípios têm até 27/3 para garantir vaga no maior evento esportivo escolar do estado,Estão abertas as inscrições para os Jogos Escolares de Minas Gerais (Jemg) 2020. Municípios interessados em participar da competição deverão se...,['Esportes'],2020-03-09 16:15:00-03:00,2020-03,2020,3,16,Tarde,1,325,10,4,https://www.agenciaminas.mg.gov.br/noticia/inscricoes-para-os-jogos-escolares-de-minas-gerais-estao-abertas
"Lei de Incentivo ao Esporte garantiu R$ 17,9 milhões para cidades mineiras em 2019","Ao todo, 101 projetos captados por meio do mecanismo estadual beneficiaram mais de 62 mil pessoas","Coordenada pela Secretaria de Estado de Desenvolvimento Social (Sedese) por meio da Subsecretaria de Esportes, a Lei de Incentivo ao Esporte...",['Esportes'],2020-01-21 10:45:00-03:00,2020-01,2020,1,10,Manhã,1,486,14,4,https://www.agenciaminas.mg.gov.br/noticia/lei-de-incentivo-ao-esporte-garantiu-r-17-9-milhoes-para-cidades-mineiras-em-2019
Parceria leva prática de skate para unidade feminina do sistema socioeducativo,Adolescentes em cumprimento de medida socioeducativa estão aprendendo os primeiros “passos” no esporte olímpico durante o mês de janeiro,Buscar atividades interessantes para preencher o tempo dos jovens e trabalhar a ressocialização durante o período de férias escolares não é tarefa...,"['Esportes', 'Segurança']",2020-01-16 11:14:00-03:00,2020-01,2020,1,11,Manhã,2,675,11,4,https://www.agenciaminas.mg.gov.br/noticia/parceria-leva-pratica-de-skate-para-unidade-feminina-do-sistema-socioeducativo
"ICMS Esportivo garantiu R$ 9,6 mi a municípios mineiros neste ano","Em 2020, programa de incentivo terá participação histórica com 10.602 ações esportivas em 416 municípios",A Secretaria de Estado de Desenvolvimento Social (Sedese) conseguiu ações importantes neste ano por meio da Subsecretaria de Esportes. O programa...,['Esportes'],2019-12-26 12:15:00-03:00,2019-12,2019,12,12,Tarde,1,650,11,4,https://www.agenciaminas.mg.gov.br/noticia/icms-esportivo-garantiu-r-9-6-mi-a-municipios-mineiros-neste-ano
Curso on-line sobre Lei de Incentivo ao Esporte inaugura nova plataforma de capacitação,Qualificação garante maior conhecimento sobre a norma e informações sobre critérios de captação de recurso,"A Secretaria de Estado de Desenvolvimento Social (Sedese), por meio da Subsecretaria de Esportes e do Observatório do Esporte de Minas Gerais,...",['Esportes'],2019-12-17 10:40:00-03:00,2019-12,2019,12,10,Manhã,1,642,13,4,https://www.agenciaminas.mg.gov.br/noticia/curso-on-line-sobre-lei-de-incentivo-ao-esporte-inaugura-nova-plataforma-de-capacitacao
Atletas e personalidades do esporte recebem premiação,"3ª edição do Prêmio do Esporte Mineiro homenageou atletas, projetos e entidades que fomentam a área","Prestigiar e reconhecer a contribuição de atletas, projetos e entidades que promovem o esporte em Minas Gerais é o objetivo do Prêmio do Esporte...","['Social', 'Esportes', 'Educação']",2019-12-12 15:45:00-03:00,2019-12,2019,12,15,Tarde,3,634,7,4,https://www.agenciaminas.mg.gov.br/noticia/atletas-e-personalidades-do-esporte-recebem-premiacao
Minas Gerais termina Jogos Escolares da Juventude com 34 medalhas,"Organizados pelo Comitê Olímpico do Brasil, jogos são o maior celeiro de atletas olímpicos do país",Crédito: Marcus Cicarini A delegação de Minas Gerais encerrou a participação nos Jogos Escolares da Juventude – etapa para...,['Esportes'],2019-12-03 16:02:00-03:00,2019-12,2019,12,16,Tarde,1,994,10,4,https://www.agenciaminas.mg.gov.br/noticia/minas-gerais-termina-jogos-escolares-da-juventude-com-34-medalhas
Oficinas de esportes paralímpicos mobilizam crianças e adolescentes de Brumadinho,"Realizadas pela Sedese, ações beneficiaram cerca de 2,7 mil crianças e adolescentes durante todo o ano","Crédito: Sedese / Divulgação A Secretaria de Estado de Desenvolvimento Social (Sedese), por meio da Subsecretaria de...","['Social', 'Esportes', 'Brumadinho']",2019-11-29 15:55:00-03:00,2019-11,2019,11,15,Tarde,3,501,10,4,https://www.agenciaminas.mg.gov.br/noticia/oficinas-de-esportes-paralimpicos-mobilizam-criancas-e-adolescentes-de-brumadinho
Atletas mineiros conquistam 75 medalhas nas Paralimpíadas Escolares em São Paulo ,"Delegação de Minas Gerais ficou, ainda, com o troféu de 3º lugar geral no tênis de mesa","Atletas mineiros que participaram das Paralimpíadas Escolares, realizadas em São Paulo este ano, voltam para casa com 75 medalhas, conquistadas em...","['Social', 'Esportes']",2019-11-26 11:15:00-03:00,2019-11,2019,11,11,Manhã,2,377,11,4,https://www.agenciaminas.mg.gov.br/noticia/atletas-mineiros-conquistam-75-medalhas-nas-paralimpiadas-escolares-em-sao-paulo
Sedese divulga edital para seleção de atletas e técnicos em Minas,Inscrições vão até 16/12. Será possível cadastrar apenas um resultado em cada nível de bolsa disponível,"A Secretaria de Estado de Desenvolvimento Social (Sedese), por meio da Subsecretaria de Esportes, está com inscrições abertas para o edital 2019 do...",['Esportes'],2019-11-22 10:16:00-03:00,2019-11,2019,11,10,Manhã,1,717,11,4,https://www.agenciaminas.mg.gov.br/noticia/sedese-divulga-edital-para-selecao-de-atletas-e-tecnicos-em-minas
Governo de Minas publica edital voltado à promoção de atividades físicas para pessoas com deficiência ,Interessados em participar do programa Núcleos de Fomento ao Paradesporto podem se inscrever até 11/8,"O Governo de Minas publicou o novo edital do programa Núcleos de Fomento ao Paradesporto (NFP), coordenado pela Secretaria de Estado de...","['Social', 'Esportes']",2025-07-14 17:25:00-03:00,2025-07,2025,7,17,Tarde,2,324,15,4,https://www.agenciaminas.mg.gov.br/noticia/governo-de-minas-publica-edital-voltado-a-promocao-de-atividades-fisicas-para-pessoas-com-deficiencia
Atletas mineiros competem nos Jogos Escolares da Juventude,Evento em Blumenau (SC) vai até 30/11 e tem participação de 267 esportistas de Minas Gerais,"A secretária de Estado de Desenvolvimento Social, Elizabeth Jucá, e o subsecretário de Esportes, Pelé do Vôlei, estiveram nessa quinta-feira...","['Social', 'Esportes']",2019-11-22 10:15:00-03:00,2019-11,2019,11,10,Manhã,2,508,8,4,https://www.agenciaminas.mg.gov.br/noticia/atletas-mineiros-competem-nos-jogos-escolares-da-juventude
Edital seleciona parceiros para ações de fomento ao esporte,Chamada da Sedese também busca apoio ao paradesporto escolar e realização do Jemg 2020/2021,A Secretaria de Estado de Desenvolvimento Social (Sedese) está com edital aberto para recebimento de propostas de Organizações da Sociedade Civil...,['Esportes'],2019-11-21 15:24:00-03:00,2019-11,2019,11,15,Tarde,1,267,9,4,https://www.agenciaminas.mg.gov.br/noticia/edital-seleciona-parceiros-para-acoes-de-fomento-ao-esporte
"Segurança terá planejamento especial no domingo, dia de clássico e Enem","Nove instituições vão trabalhar de forma integrada, para reforço de policiamento, fiscalização de trânsito e monitoramento no Centro Integrado de Comando e Controle (CICC)","O planejamento integrado de Segurança Pública e ttrânsito que será utilizado por nove instituições no próximo domingo (10/11), dia de clássico...","['Esportes', 'Segurança']",2019-11-08 15:27:00-03:00,2019-11,2019,11,15,Tarde,2,676,11,4,https://www.agenciaminas.mg.gov.br/noticia/seguranca-tera-planejamento-especial-no-domingo-dia-de-classico-e-enem
Secretaria de Desenvolvimento Social apresenta balanço das ações no Assembleia Fiscaliza,Elizabeth Jucá falou sobre a atuação da pasta no último quadrimestre e destacou os avanços alcançados,"A secretária de Estado de Desenvolvimento Social (Sedese), Elizabeth Jucá, participou nesta quinta-feira (10/10), na Assembleia Legislativa de...","['Trabalho', 'Social', 'Esportes', 'Direitos Humanos']",2019-10-10 16:40:00-03:00,2019-10,2019,10,16,Tarde,4,774,11,4,https://www.agenciaminas.mg.gov.br/noticia/secretaria-de-desenvolvimento-social-apresenta-balanco-das-acoes-no-assembleia-fiscaliza
"Geração Esporte vai beneficiar 2,4 mil crianças e adolescentes","Programa estadual, executado pela Sedese, reforça política de valorização do esporte e inclusão social","A Secretaria de Estado de Desenvolvimento Social (Sedese), por meio da Subsecretaria de Esportes, divulga o edital de seleção do Programa Geração...","['Social', 'Esportes']",2019-10-08 12:39:00-03:00,2019-10,2019,10,12,Tarde,2,331,9,4,https://www.agenciaminas.mg.gov.br/noticia/geracao-esporte-vai-beneficiar-2-4-mil-criancas-e-adolescentes
Sedese divulga relatório dos índices definitivos do ICMS Solidário,Os municípios contemplados vão receber os recursos no ano de 2020,"A Secretaria de Estado de Desenvolvimento Social (Sedese), por meio da Subsecretaria de Estado de Esportes, disponibilizou o Relatório dos Dados...",['Esportes'],2019-09-25 15:12:00-03:00,2019-09,2019,9,15,Tarde,1,305,9,4,https://www.agenciaminas.mg.gov.br/noticia/sedese-divulga-relatorio-dos-indices-definitivos-do-icms-solidario
Sedese lança quatro editais da Lei de Incentivo para execução de projetos esportivos,"Neste ano, R$ 19,3 milhões serão destinados a projetos aprovados pela Subsecretaria de Esportes","A Secretaria de Estado de Desenvolvimento Social (Sedese) publicou nesta terça-feira (24/9), no Diário Oficial do Estado, quatro novos editais da...",['Esportes'],2019-09-24 17:04:00-03:00,2019-09,2019,9,17,Tarde,1,731,13,4,https://www.agenciaminas.mg.gov.br/noticia/sedese-lanca-quatro-editais-da-lei-de-incentivo-para-execucao-de-projetos-esportivos
Torcedores com deficiência entram com jogadores no gramado do Mineirão,"Ação articulada entre Sedese, Prefeitura de BH, Cruzeiro e administração do estádio faz parte da programação do Setembro Verde","A Secretaria de Estado de Desenvolvimento Social (Sedese) realizou no último sábado (21/9), em parceria com a Prefeitura de Belo Horizonte, o...","['Social', 'Esportes']",2019-09-23 11:51:00-03:00,2019-09,2019,9,11,Manhã,2,594,10,4,https://www.agenciaminas.mg.gov.br/noticia/torcedores-com-deficiencia-entram-com-jogadores-no-gramado-do-mineirao
Oficinas levam esporte adaptado para o ambiente escolar em Brumadinho,Ação da Secretaria de Desenvolvimento Social promove inclusão e conhecimento para os alunos,"A Secretaria de Estado de Desenvolvimento Social (Sedese), por meio da Subsecretaria de Esportes, realizou, nessa quinta-feira (19/9) oficinas de...","['Social', 'Esportes', 'Brumadinho']",2019-09-20 12:11:00-03:00,2019-09,2019,9,12,Tarde,3,966,10,4,https://www.agenciaminas.mg.gov.br/noticia/oficinas-levam-esporte-adaptado-para-o-ambiente-escolar-em-brumadinho
Minas Gerais tem mais oito equipes classificadas para a etapa nacional dos Jogos Escolares da Juventude,Equipes conquistaram as vagas em Cascavel (PR) e se juntam aos outros representantes do estado na etapa nacional que será em Blumenau (SC),"Oito equipes mineiras garantiram vaga na etapa nacional dos Jogos Escolares da Juventude de 2019 (JEJ), que será realizada no período de 16 a 30 de...","['Social', 'Esportes', 'Educação']",2019-09-11 11:10:00-03:00,2019-09,2019,9,11,Manhã,3,752,16,4,https://www.agenciaminas.mg.gov.br/noticia/minas-gerais-tem-mais-oito-equipes-classificadas-para-a-etapa-nacional-dos-jogos-escolares-da-juventude
Mineirinho vira o palco do Arraial de Belô pelo segundo ano consecutivo,Espaço concedido pelo Governo de Minas recebe o maior evento junino da capital mineira a partir desta sexta-feira (11/7),"O Estádio Jornalista Felippe Drummond, mais conhecido como Mineirinho, mostra a versatilidade e a importância que tem para os mineiros, e se...","['Infraestrutura', 'Esportes', 'Cultura']",2025-07-11 17:40:00-03:00,2025-07,2025,7,17,Tarde,3,554,12,4,https://www.agenciaminas.mg.gov.br/noticia/mineirinho-vira-o-palco-do-arraial-de-belo-pelo-segundo-ano-consecutivo
Aluno mineiro conquista cinco medalhas nos Jogos Parapan-Americanos no Peru,"Gabriel Geraldo dos Santos é aluno do 3º ano do ensino médio da Escola Estadual Professora Maria Amélia Campos, em Corinto, na região Central do estado","Gabriel Geraldo dos Santos aprendeu a nadar aos quatro anos e o que começou como uma brincadeira, hoje, aos 17 anos, realiza sonhos. Atleta...","['Esportes', 'Educação']",2019-09-06 11:35:00-03:00,2019-09,2019,9,11,Manhã,2,468,10,4,https://www.agenciaminas.mg.gov.br/noticia/aluno-mineiro-conquista-cinco-medalhas-nos-jogos-parapan-americanos-no-peru
Delegação mineira embarca para disputa da regional dos Jogos Escolares da Juventude,"Noventa e dois estudantes-atletas de nove escolas vão representar Minas Gerais na competição, que acontece em Cascavel (PR)","A delegação mineira embarcou nesta segunda-feira (2/9), no Aeroporto Internacional Tancredo Neves, em Confins, para a disputa da etapa regional dos...","['Social', 'Esportes', 'Educação']",2019-09-02 15:15:00-03:00,2019-09,2019,9,15,Tarde,3,450,12,4,https://www.agenciaminas.mg.gov.br/noticia/delegacao-mineira-embarca-para-disputa-da-regional-dos-jogos-escolares-da-juventude
Governo publica edital 2019 do programa Bolsa Atleta e Bolsa Técnico paralímpicos,As inscrições terminam no próximo dia 12 de setembro,"A Secretaria de Estado de Desenvolvimento Social (Sedese) publicou, na edição desta terça-feira (27/8) do Diário Oficial Minas Gerais, o edital...","['Social', 'Esportes']",2019-08-27 14:35:00-03:00,2019-08,2019,8,14,Tarde,2,700,12,4,https://www.agenciaminas.mg.gov.br/noticia/governo-publica-edital-2019-do-programa-bolsa-atleta-e-bolsa-tecnico-paralimpicos
Emoção no final dos Jogos Escolares de Minas Gerais 2019,Competição contou com participação de estudantes-atletas de mais de 98% dos municípios mineiros,"Os Jogos Escolares de Minas Gerais (Jemg) 2019 chegaram ao fim com grandes momentos para estudantes-atletas, professores, familiares, árbitros e...","['Esportes', 'Educação']",2019-08-06 11:49:00-03:00,2019-08,2019,8,11,Manhã,2,797,10,4,https://www.agenciaminas.mg.gov.br/noticia/emocao-no-final-dos-jogos-escolares-de-minas-gerais-2019
Jemg já tem vários medalhistas nas modalidades individuais e paralímpicas,"Competição, que termina neste sábado (3/8), reúne cerca de 6,5 mil estudantes-atletas","A disputa pelas medalhas de ouro, prata e bronze dos Jogos Escolares de Minas Gerais – Jemg/2019 estão acirradas. As competições, que estão sendo...","['Social', 'Esportes']",2019-08-02 11:05:00-03:00,2019-08,2019,8,11,Manhã,2,472,10,4,https://www.agenciaminas.mg.gov.br/noticia/jemg-ja-tem-varios-medalhistas-nas-modalidades-individuais-e-paralimpicas
Competições dos Jogos Escolares de Minas Gerais movimentam Uberlândia,"Abertura oficial do evento, que reúne 6,5 mil estudantes-atletas, foi realizada na noite de terça-feira (30/7)","Milhares de pessoas participaram, nesta terça-feira (30/7), da abertura da etapa estadual dos Jogos Escolares de Minas Gerais (Jemg), no município...","['Social', 'Esportes', 'Educação']",2019-07-31 14:40:00-03:00,2019-07,2019,7,14,Tarde,3,857,9,4,https://www.agenciaminas.mg.gov.br/noticia/competicoes-dos-jogos-escolares-de-minas-gerais-movimentam-uberlandia
"Final dos Jogos Escolares de MG vai reunir cerca de 6,5 mil estudantes-atletas","Disputas do maior evento escolar do país vão ocorrer em Uberlândia, no Triângulo Mineiro, na próxima semana","A partir de terça-feira (30/7), aproximadamente 6,5 mil estudantes-atletas vão disputar, em Uberlândia, a final de 2019 dos Jogos Escolares de...","['Esportes', 'Educação']",2019-07-26 09:21:00-03:00,2019-07,2019,7,9,Manhã,2,427,13,4,https://www.agenciaminas.mg.gov.br/noticia/final-dos-jogos-escolares-de-mg-vai-reunir-cerca-de-6-5-mil-estudantes-atletas
Regional do Jemg reúne cerca de 10 mil estudantes-atletas,"Fase estadual acontecerá no período de 29 de julho a 3 de agosto no município de Uberlândia, no Triângulo Mineiro","Crédito: Tiago Ciccarini Cerca de 10 mil estudantes-atletas disputaram, na última semana, uma vaga para a etapa estadual da...","['Esportes', 'Educação']",2019-07-05 14:02:00-03:00,2019-07,2019,7,14,Tarde,2,486,9,4,https://www.agenciaminas.mg.gov.br/noticia/regional-do-jemg-reune-cerca-de-10-mil-estudantes-atletas
Estudantes de BH vão carregar bandeiras de Brasil e Argentina no Mineirão,"Ao todo, 26 alunos da Escola Estadual Tomás Brandão vão acompanhar de perto a partida válida pela semifinal da Copa América","Esta terça-feira (2/7) é de expectativa para 26 alunos do ensino fundamental da Escola Estadual Tomás Brandão, em Belo Horizonte. Eles terão a...","['Educação', 'Esportes']",2019-07-02 17:02:00-03:00,2019-07,2019,7,17,Tarde,2,425,12,4,https://www.agenciaminas.mg.gov.br/noticia/estudantes-de-bh-vao-carregar-bandeiras-de-brasil-e-argentina-no-mineirao
Governo facilita cadastro de gestor esportivo municipal com passo a passo,"Em vídeo no Youtube, interessados contam com informações para auxiliar no preenchimento","A Secretaria de Estado de Desenvolvimento Social (Sedese), por meio da Subsecretaria de Esportes, disponibilizou vídeo em seu canal do Youtube com...","['Esportes', 'Social']",2019-06-28 11:10:00-03:00,2019-06,2019,6,11,Manhã,2,480,11,4,https://www.agenciaminas.mg.gov.br/noticia/governo-facilita-cadastro-de-gestor-esportivo-municipal-com-passo-a-passo
Governo de Minas inaugura quadra poliesportiva em Andradas e fortalece infraestrutura escolar,Novo espaço amplia oportunidades para prática esportiva e atividades pedagógicas na rede municipal,"O governador Mateus Simões inaugurou, nessa sexta-feira (10/4), a quadra poliesportiva Rita Aparecida Carvalho Giaretta, na Escola Municipal...","['Governo', 'Esportes', 'Educação', 'Governador']",2026-04-11 18:20:00-03:00,2026-04,2026,4,18,Noite,4,630,12,4,https://www.agenciaminas.mg.gov.br/noticia/governo-de-minas-inaugura-quadra-poliesportiva-em-andradas-e-fortalece-infraestrutura-escolar
Governo de Minas impulsiona esporte para estudantes com a aquisição de kits pelas escolas,Investimento de R$ 121 milhões do Premiep já transforma as aulas de Educação Física e incentiva a participação dos alunos nos Jogos Escolares de Minas Gerais,As escolas da rede estadual de Minas Gerais vivem um novo momento no incentivo à prática esportiva. Com recursos do Programa Estadual de Melhoria e...,"['Esportes', 'Educação']",2025-07-09 09:30:00-03:00,2025-07,2025,7,9,Manhã,2,802,14,4,https://www.agenciaminas.mg.gov.br/noticia/governo-de-minas-impulsiona-esporte-para-estudantes-com-a-aquisicao-de-kits-pelas-escolas
Jemg encerra inscrições nesta sexta-feira (28/6),Interessados nas modalidades individuais e paraolímpicas devem preencher o documento disponível no site do Jemg,Estudantes-atletas devem estar atentos. Termina nesta sexta-feira (28/6) o prazo para inscrições nas modalidades individuais e paralímpicas dos...,"['Social', 'Esportes']",2019-06-27 17:05:00-03:00,2019-06,2019,6,17,Tarde,2,427,6,4,https://www.agenciaminas.mg.gov.br/noticia/jemg-encerra-inscricoes-nesta-sexta-feira-28-6
Beneficiários de programas sociais vibram em partida entre Equador e Japão no Mineirão,Parceria entre a Sedese e a Conmebol disponibilizou 800 ingressos sociais para dois jogos da Copa América,"O empate por 1 a 1 entre Equador e Japão na noite dessa segunda-feira (24/6), no Mineirão, pela Copa América, teve entre os espectadores um público...","['Social', 'Esportes']",2019-06-25 13:13:00-03:00,2019-06,2019,6,13,Tarde,2,983,13,4,https://www.agenciaminas.mg.gov.br/noticia/beneficiarios-de-programas-sociais-vibram-em-partida-entre-equador-e-japao-no-mineirao
Começa em Minas Gerais a etapa regional do Jemg 2019,Cerca de 12 mil estudantes-atletas participam das disputas em sete cidades-sede,Tem início nesta segunda-feira (24/6) - e termina no sábado (29/6) - a etapa regional dos Jogos Escolares de Minas Gerais (Jemg-2019). Cerca de 12...,"['Esportes', 'Educação']",2019-06-24 15:50:00-03:00,2019-06,2019,6,15,Tarde,2,393,10,4,https://www.agenciaminas.mg.gov.br/noticia/comeca-em-minas-gerais-a-etapa-regional-do-jemg-2019
