titulo,subtitulo,descricao,temas,data,ano_mes,ano,mes,hora,turno,n_temas,tamanho_texto,n_palavras_titulo,n_relacionadas,url
Sedese distribui ingressos sociais para jogos da Copa América,"Para as partidas que acontecem no sábado (22/6) e na segunda-feira (24/6) no Mineirão, em Belo Horizonte, estão disponíveis 800 ingressos",Beneficiários de programas e ações sociais da Secretaria de Estado de Desenvolvimento Social (Sedese) serão contemplados com ingressos...,['Esportes'],2019-06-19 13:45:00-03:00,2019-06,2019,6,13,Tarde,1,810,9,4,https://www.agenciaminas.mg.gov.br/noticia/sedese-distribui-ingressos-sociais-para-jogos-da-copa-america
Governo assegura serviços essenciais à saúde durante Copa América,Secretaria preparou cartilha com orientações aos turistas que pretendem visitar o estado,"A Secretaria de Estado de Saúde (SES) vem se planejando para oferecer apoio à realização da Copa América 2019, que será sediada no Brasil. O...","['Saúde', 'Esportes']",2019-06-13 10:25:00-03:00,2019-06,2019,6,10,Manhã,2,531,9,4,https://www.agenciaminas.mg.gov.br/noticia/governo-assegura-servicos-essenciais-a-saude-durante-copa-america
Governo quer evitar violações de direitos de crianças e adolescentes durante Copa América,Sedese enviou a BH e municípios do entorno da capital Documento Orientador para a proteção deste público durante o evento,"Com o início dos jogos da Copa América nesta sexta-feira (14/6) e como um das ações do Dia Mundial de Combate ao Trabalho Infantil, celebrado nesta...","['Social', 'Esportes']",2019-06-12 12:27:00-03:00,2019-06,2019,6,12,Tarde,2,343,13,4,https://www.agenciaminas.mg.gov.br/noticia/governo-quer-evitar-violacoes-de-direitos-de-criancas-e-adolescentes-durante-copa-america
Comprovação de programas e projetos no ICMS Esportivo bate recorde,"Até 3 de junho, mais de 10,5 mil ações esportivas foram comprovadas em todo o estado",A comprovação da realização de programas ou projetos com recursos do ICMS Esportivo bateu recorde neste ano pelos municípios mineiros. Até o dia...,['Esportes'],2019-06-07 09:15:00-03:00,2019-06,2019,6,9,Manhã,1,467,10,4,https://www.agenciaminas.mg.gov.br/noticia/comprovacao-de-programas-e-projetos-no-icms-esportivo-bate-recorde
Encerrada etapa microrregional dos Jogos Escolares,Participação registrada foi de 35 mil estudantes-atletas em seis mil competições preparatórias para a fase regional,A etapa microrregional dos Jogos Escolares de Minas Gerais (Jemg) chegou ao fim. Com realização em 1.650 escolas em 50 sedes distribuídas pelo...,"['Esportes', 'Educação']",2019-06-06 12:46:00-03:00,2019-06,2019,6,12,Tarde,2,761,6,4,https://www.agenciaminas.mg.gov.br/noticia/encerrada-etapa-microrregional-dos-jogos-escolares
Lei Estadual de Incentivo ao Esporte se consolida a cada ano em Minas Gerais,"Em 2019, o limite para captação de recursos é de R$ 18,1 milhões, o equivalente a 0,05% do ICMS arrecadado em 2018","Desde a sanção da Lei 20.824/2013, que fomenta a prática esportiva em Minas Gerais, os projetos apresentados por entidades sem fins lucrativos,...",['Esportes'],2019-05-22 16:02:00-03:00,2019-05,2019,5,16,Tarde,1,731,14,4,https://www.agenciaminas.mg.gov.br/noticia/lei-estadual-de-incentivo-ao-esporte-se-consolida-a-cada-ano-em-minas-gerais
Definidas as cidades-sedes das etapas regional e estadual do Jemg,"Nesta semana, mais sete municípios recebem milhares de estudantes na penúltima semana da etapa microrregional","O Governo de Minas definiu as seis cidades-sede da etapa regional dos Jogos Escolares de Minas Gerais – Jemg 2019, bem como o município que...","['Esportes', 'Educação']",2019-05-21 09:45:00-03:00,2019-05,2019,5,9,Manhã,2,544,10,4,https://www.agenciaminas.mg.gov.br/noticia/definidas-as-cidades-sedes-das-etapas-regional-e-estadual-do-jemg
Governo de Minas seleciona 29 municípios para o programa Geração Esporte,"Com investimento de mais de R$ 7,6 milhões, programa da Sedese promove inclusão esportiva de crianças e adolescentes","O Governo de Minas publicou, na sexta-feira (4/7), o resultado do edital do programa Geração Esporte. A lista contempla 29 municípios que serão...","['Social', 'Esportes']",2025-07-07 13:20:00-03:00,2025-07,2025,7,13,Tarde,2,565,11,4,https://www.agenciaminas.mg.gov.br/noticia/governo-de-minas-seleciona-29-municipios-para-o-programa-geracao-esporte
Interno do Centro Socioeducativo de Juiz de Fora ganha vaga em time de futebol,"Destaque nas oficinas esportivas da unidade, jovem é selecionado para o time sub-17 do Uberabinha e vai jogar série A do Campeonato Mineiro","Como toda criança, Arthur Aguiar* sempre sonhou em ser jogador de futebol e adorava jogar bola com os amigos na rua de casa. O tempo passou e a...","['Esportes', 'Segurança']",2019-05-02 13:57:00-03:00,2019-05,2019,5,13,Tarde,2,672,14,4,https://www.agenciaminas.mg.gov.br/noticia/interno-do-centro-socioeducativo-de-juiz-de-fora-ganha-vaga-em-time-de-futebol
Inscrições abertas para competições no Jemg,Interessados em disputas individuais e paraolímpicas devem se inscrever até o dia 28/6,"Estão abertas, até o dia 28 de junho, as inscrições nas modalidades individuais e paralímpicas para a etapa estadual dos Jogos Escolares de Minas...","['Social', 'Esportes', 'Educação']",2019-04-25 11:15:00-03:00,2019-04,2019,4,11,Manhã,3,272,6,4,https://www.agenciaminas.mg.gov.br/noticia/inscricoes-abertas-para-competicoes-no-jemg
Esporte mobiliza jovem para o ensino superior,Paixão pelo futebol foi combustível para João Marcos Oliveira cursar Educação Física,"O sonho de ser jogador profissional de futebol terminou há cerca de um ano para João Marcos Rodrigues de Oliveira, um jovem de 18 anos que mora no...","['Esportes', 'Educação']",2019-04-19 10:05:00-03:00,2019-04,2019,4,10,Manhã,2,1173,7,4,https://www.agenciaminas.mg.gov.br/noticia/esporte-mobiliza-jovem-para-o-ensino-superior
Estudantes da rede estadual participam do Combate Games,Disputa reúne estudantes atletas de artes marciais e vale vagas para a competição mundial na Europa,"Nesta quinta-feira (18/4), 22 estudantes de escolas estaduais de vários municípios mineiros participam do Campeonato Brasileiro Escolar de Combate...","['Esportes', 'Educação']",2019-04-17 13:42:00-03:00,2019-04,2019,4,13,Tarde,2,650,8,4,https://www.agenciaminas.mg.gov.br/noticia/estudantes-da-rede-estadual-participam-do-combate-games
"Com recorde de inscritos, Jogos Escolares têm início na próxima semana","Competições da microrregional começam a partir de segunda-feira, dia 22 de abril, e serão realizadas até 2 de junho","Estudantes-atletas dão o pontapé inicial na próxima segunda-feira (22/4) aos Jogos Escolares de Minas Gerais (Jemg), na etapa  microrregional da...",['Esportes'],2019-04-17 11:46:00-03:00,2019-04,2019,4,11,Manhã,1,494,11,4,https://www.agenciaminas.mg.gov.br/noticia/com-recorde-de-inscritos-jogos-escolares-tem-inicio-na-proxima-semana
Mineirinho sedia final inédita da Superliga Feminina de Vôlei,"Itambé/Minas e Dentil/Praia Clube abrem disputa do título no próximo dia 21, às 11h","O ginásio do Mineirinho, em Belo Horizonte, administrado pela Subsecretaria de Esportes da Secretaria de Estado de Desenvolvimento Social (Sedese),...",['Esportes'],2019-04-16 11:44:00-03:00,2019-04,2019,4,11,Manhã,1,554,9,4,https://www.agenciaminas.mg.gov.br/noticia/mineirinho-sedia-final-inedita-da-superliga-feminina-de-volei
Minas Gerais recebe Festival Paralímpico,"O evento, que está em sua segunda edição, tem como objetivo fomentar o esporte para pessoas com deficiência","Segundo estado com maior número de municípios participantes, Minas Gerais começa a se organizar para receber o Festival Paralímpico, previsto para...","['Social', 'Esportes', 'Educação']",2019-04-11 12:26:00-03:00,2019-04,2019,4,12,Tarde,3,387,5,4,https://www.agenciaminas.mg.gov.br/noticia/minas-gerais-recebe-festival-paralimpico
Inscrições para o Jemg batem novo recorde,"Neste ano, 839 cidades garantiram vaga na competição voltada para rede pública e particular de ensino","Os Jogos Escolares de Minas Gerais (Jemg) alcançaram nova marca em 2019. Em mais um recorde, o maior evento esportivo-social do Brasil recebeu...",['Esportes'],2019-03-13 10:44:00-03:00,2019-03,2019,3,10,Manhã,1,502,7,4,https://www.agenciaminas.mg.gov.br/noticia/inscricoes-para-o-jemg-batem-novo-recorde
Sedese divulga municípios aptos a participarem do ICMS Esportivo,Cadastro das atividades esportivas do ano base 2018 deve ser feito até o dia 30 de março. Participação é recorde,"A Secretaria de Estado de Desenvolvimento Social (Sedese), por meio da Subsecretaria de Esportes, divulga a listagem dos municípios habilitados...","['Social', 'Esportes']",2019-03-12 10:10:00-03:00,2019-03,2019,3,10,Manhã,2,528,9,4,https://www.agenciaminas.mg.gov.br/noticia/sedese-divulga-municipios-aptos-a-participarem-do-icms-esportivo
Definidas as cidades-sede da etapa microrregional do Jemg,Municípios interessados em garantir uma vaga para as disputas têm até o próximo dia 11 para fazer as inscrições,"O Governo de Minas já definiu os municípios-sede da etapa microrregional dos Jogos Escolares de Minas Gerais (Jemg) 2019, o maior evento...","['Esportes', 'Educação']",2019-03-07 11:01:00-03:00,2019-03,2019,3,11,Manhã,2,475,8,4,https://www.agenciaminas.mg.gov.br/noticia/definidas-as-cidades-sede-da-etapa-microrregional-do-jemg
Pará de Minas e Araguari são definidas como sedes da etapa estadual dos Jogos Escolares de Minas Gerais ,Próxima fase da competição organizada pelo Governo do Estado será realizada entre 4 e 24/8,"As cidades de Pará de Minas, na Região Metropolitana de Belo Horizonte (RMBH), e Araguari, no Triângulo Mineiro/Alto Paranaíba, vão sediar as...","['Social', 'Esportes', 'Educação']",2025-07-03 17:40:00-03:00,2025-07,2025,7,17,Tarde,3,382,18,4,https://www.agenciaminas.mg.gov.br/noticia/para-de-minas-e-araguari-sao-definidas-como-sedes-da-etapa-estadual-dos-jogos-escolares-de-minas-gerais
Inscrições para o Jemg terminam na próxima segunda (11/3),Representante municipal deve acessar o site da competição para inscrição das cidades e escolas,Últimos dias para inscrições nos Jogos Escolares de Minas Gerais (Jemg) de 2019. Para garantir participação no maior evento esportivo-social do...,"['Esportes', 'Educação']",2019-03-06 10:39:00-03:00,2019-03,2019,3,10,Manhã,2,352,9,4,https://www.agenciaminas.mg.gov.br/noticia/inscricoes-para-o-jemg-terminam-na-proxima-segunda-11-3
Jogos Escolares de Minas Gerais já têm 668 municípios inscritos,"Para garantir uma vaga no evento, representante municipal deve acessar o site da competição","O término das inscrições será daqui a 13 dias, mas quase 80% dos municípios mineiros já garantiram uma vaga nos Jogos Escolares de Minas Gerais...","['Esportes', 'Educação']",2019-02-26 15:25:00-03:00,2019-02,2019,2,15,Tarde,2,541,10,4,https://www.agenciaminas.mg.gov.br/noticia/jogos-escolares-de-minas-gerais-ja-tem-668-municipios-inscritos
Time feminino de escola estadual participa de seletiva de futebol,"Competição vai selecionar representantes para próxima edição do Mundial Escolar, que será disputado na Sérvia, em abril","Chuteira e uniforme na mala e, no coração, muita ansiedade. É assim que está a estudante do 2º ano do ensino médio, Laís Leandra da Silva. Aluna da...","['Esportes', 'Educação']",2019-02-20 14:02:00-03:00,2019-02,2019,2,14,Tarde,2,403,10,4,https://www.agenciaminas.mg.gov.br/noticia/time-feminino-de-escola-estadual-participa-de-seletiva-de-futebol
Abertas inscrições para os Jogos Escolares de Minas Gerais,Municípios têm até dia 11 de março para garantir uma vaga no maior evento esportivo escolar do estado que será realizado em três etapas,"As cidades interessadas em garantir uma vaga no maior evento esportivo-social do Governo de Minas, os Jogos Escolares de Minas Gerais  (Jemg) de...","['Social', 'Esportes']",2019-02-13 10:58:00-02:00,2019-02,2019,2,10,Manhã,2,492,9,4,https://www.agenciaminas.mg.gov.br/noticia/abertas-inscricoes-para-os-jogos-escolares-de-minas-gerais
Governo do Estado leva recreação para as crianças de Brumadinho,"Iniciativas da Sedese e da PM proporcionam atividades de lazer, esportes e cultura no local","Os mascotes do Atlético, América e Cruzeiro fizeram a alegria de crianças e adolescentes na região do Parque da Cachoeira, em Brumadinho, nesta...","['Social', 'Governo', 'Esportes', 'Segurança', 'Brumadinho']",2019-02-06 13:28:00-02:00,2019-02,2019,2,13,Tarde,5,578,10,4,https://www.agenciaminas.mg.gov.br/noticia/governo-do-estado-leva-recreacao-para-as-criancas-de-brumadinho
Governo de Minas leva atividades recreativas às crianças em Brumadinho,Boletim Brumadinho – 12h,"O Governo do Estado, por meio da Secretaria de Desenvolvimento Social, oferece até quarta-feira (6/2), no Parque Cachoeira, em Brumadinho, uma...","['Social', 'Governo', 'Esportes', 'Cultura', 'Brumadinho']",2019-02-05 12:03:00-02:00,2019-02,2019,2,12,Tarde,5,274,10,4,https://www.agenciaminas.mg.gov.br/noticia/governo-de-minas-leva-atividades-recreativas-as-criancas-em-brumadinho
"Cruzeiro é destaque na Vitória Cup, transmitida pela Rede Minas e Rádio Inconfidência ",Emissoras se unem à TVE do Espírito Santo para mostrar duelos da Raposa e Desportiva Ferroviária contra dois clubes argentinos,"A Vitória Cup, torneio de futebol durante a pausa do calendário para a Copa do Mundo de Clubes da FIFA, será realizada entre os dias 2 e 6/7. A...","['Esportes', 'Cultura']",2025-07-01 16:45:00-03:00,2025-07,2025,7,16,Tarde,2,477,13,4,https://www.agenciaminas.mg.gov.br/noticia/cruzeiro-e-destaque-na-vitoria-cup-transmitida-pela-rede-minas-e-radio-inconfidencia
Governo de Minas publica novo edital do programa Bolsa Atleta e Bolsa Técnico ,Interessados tem até o dia 24/7 para se inscreverem,"O Governo de Minas publicou o edital do programa Bolsa Atleta e Bolsa Técnico, coordenado pela Secretaria de Estado de Desenvolvimento Social...","['Social', 'Esportes']",2025-06-26 12:25:00-03:00,2025-06,2025,6,12,Tarde,2,477,13,4,https://www.agenciaminas.mg.gov.br/noticia/governo-de-minas-publica-novo-edital-do-programa-bolsa-atleta-e-bolsa-tecnico
Jogos Escolares reúnem mais de 17 mil estudantes em busca de vaga para a etapa estadual em Minas,Competição organizada pelo Governo de Minas teve 100% de adesão de municípios em 2025,"Começou nesta segunda-feira (23/6) a etapa regional dos Jogos Escolares de Minas Gerais (Jemg). Organizada pelo Governo de Minas, a competição vai...","['Social', 'Esportes', 'Educação']",2025-06-23 17:42:00-03:00,2025-06,2025,6,17,Tarde,3,537,18,4,https://www.agenciaminas.mg.gov.br/noticia/jogos-escolares-reunem-mais-de-17-mil-estudantes-em-busca-de-vaga-para-a-etapa-estadual-em-minas
Governo de Minas apresenta avanços para primeira infância e mulheres durante Assembleia Fiscaliza,Sedese destaca políticas públicas de impacto social em prestação de contas na ALMG,"O Governo de Minas consolidou avanços históricos na primeira infância, na proteção das mulheres e alcançou recordes no esporte. Essas realizações...","['Trabalho', 'Social', 'Esportes', 'Direitos Humanos']",2025-06-12 19:15:00-03:00,2025-06,2025,6,19,Noite,4,615,13,4,https://www.agenciaminas.mg.gov.br/noticia/governo-de-minas-apresenta-avancos-para-primeira-infancia-e-mulheres-durante-assembleia-fiscaliza
"Governo de Minas lança programa de fomento ao skate, basquete e outros esportes urbanos","Minas Urbano vai incentivar ainda a prática de BMX (bicicross), escalada e breaking, gerando mais oportunidades para os jovens","O Governo de Minas lançou, nesta terça-feira (3/6), o Minas Urbano, programa para fortalecer os esportes no estado, promovendo inclusão social e...","['Esportes', 'Social', 'Governo']",2025-06-03 21:00:00-03:00,2025-06,2025,6,21,Noite,3,641,14,4,https://www.agenciaminas.mg.gov.br/noticia/governo-de-minas-lanca-programa-de-fomento-ao-skate-basquete-e-outros-esportes-urbanos
Governo de Minas avança na inclusão e bate recorde de municípios inscritos no Jogos do Interior de Minas Paradesporto,JimiP reúne o maior número de inscrições da história e promove inclusão social para milhares de paratletas,Os Jogos do Interior de Minas Paradesporto (JimiP) alcançaram um marco histórico em 2025: são 634 atletas de 43 municípios inscritos para a...,"['Social', 'Esportes']",2025-05-30 16:45:00-03:00,2025-05,2025,5,16,Tarde,2,660,19,4,https://www.agenciaminas.mg.gov.br/noticia/governo-de-minas-avanca-na-inclusao-e-bate-recorde-de-municipios-inscritos-no-jogos-do-interior-de-minas-paradesporto
"Com apoio do Estado, final da primeira fase do campeonato estadual de futebol americano é disputada neste sábado (31/5) ",Competição é realizada com recursos da Lei Estadual de Incentivo ao Esporte pela Sedese,"Com o apoio do Governo de Minas, a cidade de Ibirité, na Região Metropolitana de Belo Horizonte (RMBH), recebe neste sábado (31/5), a final da...","['Social', 'Esportes']",2025-05-30 15:05:00-03:00,2025-05,2025,5,15,Tarde,2,622,19,4,https://www.agenciaminas.mg.gov.br/noticia/com-apoio-do-estado-final-da-primeira-fase-do-campeonato-estadual-de-futebol-americano-e-disputada-neste-sabado-31-5
Governo de Minas vistoria obras de revitalização de ginásio poliesportivo em Poços de Caldas,Restauro da estrutura fortalece o esporte e a inclusão social na capital provisória do estado,"O governador de Minas Gerais, Mateus Simões, vistoriou, nesta quinta-feira (9/4), o Ginásio Poliesportivo Juca Cobra, que está em obras de...","['Social', 'Governo', 'Esportes', 'Governador']",2026-04-09 14:50:00-03:00,2026-04,2026,4,14,Tarde,4,576,14,4,https://www.agenciaminas.mg.gov.br/noticia/governo-de-minas-vistoria-obras-de-revitalizacao-de-ginasio-poliesportivo-em-pocos-de-caldas
Governo de Minas reafirma apoio e potencial do estado com Mineirão confirmado para sediar a Copa do Mundo Feminina da FIFA 2027,"Atrativos turísticos, culturais e segurança estão entre diferenciais","Minas Gerais está de vez na programação da Copa do Mundo Feminina da FIFA 2027. A federação internacional anunciou, nesta quarta-feira (7/5), que...","['Turismo', 'Social', 'Infraestrutura', 'Governo', 'Esportes', 'Segurança']",2025-05-07 23:30:00-03:00,2025-05,2025,5,23,Noite,6,861,22,4,https://www.agenciaminas.mg.gov.br/noticia/governo-de-minas-reafirma-apoio-e-potencial-do-estado-com-mineirao-confirmado-para-sediar-a-copa-do-mundo-feminina-da-fifa-2027
Mineirinho volta a sediar partidas de futsal,Espaço foi modernizado após a concessão e tem recebido grandes eventos culturais e esportivos,"O Estádio Jornalista Felippe Drummond, o Mineirinho, um dos palcos esportivos mais tradicionais de Minas Gerais, volta a receber partidas de futsal...","['Infraestrutura', 'Esportes']",2025-05-07 17:00:00-03:00,2025-05,2025,5,17,Tarde,2,384,7,4,https://www.agenciaminas.mg.gov.br/noticia/mineirinho-volta-a-sediar-partidas-de-futsal
"Cemig mantém aberta seleção de projetos voltados ao esporte, à população idosa e a crianças e adolescentes",Interessados têm até o dia 11/7 para fazer as inscrições,"Continuam abertas, até 11/7, as inscrições para patrocínio de projetos pela Cemig nas áreas do esporte, população idosa e crianças e adolescentes....","['Social', 'Infraestrutura', 'Esportes']",2025-04-25 15:45:00-03:00,2025-04,2025,4,15,Tarde,3,556,17,4,https://www.agenciaminas.mg.gov.br/noticia/cemig-mantem-aberta-selecao-de-projetos-voltados-ao-esporte-a-populacao-idosa-e-a-criancas-e-adolescentes
Jogos Escolares de Minas abrem edição histórica com 100% dos municípios inscritos ,"Governo de Minas avança na inclusão esportiva no Jemg, com competições até o dia 24/8",A maior competição estudantil do país começa com marca inédita: todos os 853 municípios mineiros se inscreveram na edição 2025 dos Jogos Escolares...,"['Social', 'Esportes']",2025-04-22 17:45:00-03:00,2025-04,2025,4,17,Tarde,2,595,12,4,https://www.agenciaminas.mg.gov.br/noticia/jogos-escolares-de-minas-abrem-edicao-historica-com-100-dos-municipios-inscritos
Governo de Minas abre inscrição para Jimi Paradesporto  2025,Municípios interessados nos jogos voltados a paratletas tem até 15/5 para se inscreverem,Atletas e municípios interessados em participar da edição 2025 dos Jogos do Interior de Minas Gerais Paradesporto (JimiP) já podem fazer suas...,"['Social', 'Esportes']",2025-04-15 16:40:00-03:00,2025-04,2025,4,16,Tarde,2,414,9,4,https://www.agenciaminas.mg.gov.br/noticia/governo-de-minas-abre-inscricao-para-jimi-paradesporto-2025
"Com 100% dos municípios inscritos, Minas Gerais se prepara para os maiores jogos escolares da história","Jemg 2025 atinge adesão recorde e deve ter a participação de 60 mil estudantes, reforçando compromisso do Estado com a formação de novos talentos para o esporte","Os Jogos Escolares de Minas Gerais (Jemg) alcançaram um feito inédito em 2025 e, pela primeira vez na história, todos os 853 municípios mineiros...","['Social', 'Esportes', 'Educação']",2025-03-26 09:00:00-03:00,2025-03,2025,3,9,Manhã,3,746,16,4,https://www.agenciaminas.mg.gov.br/noticia/com-100-dos-municipios-inscritos-minas-gerais-se-prepara-para-os-maiores-jogos-escolares-da-historia
Rede Minas se torna referência na cobertura esportiva em Minas Gerais,Meio milhão de pessoas acompanharam as transmissões de disputas esportivas em 2024,"A Rede Minas se consolidou como a casa do esporte, mostrando jogos e competições de diversas modalidades na TV aberta. Em 2024, as transmissões...","['Cultura', 'Esportes']",2025-03-24 17:20:00-03:00,2025-03,2025,3,17,Tarde,2,553,11,4,https://www.agenciaminas.mg.gov.br/noticia/rede-minas-se-torna-referencia-na-cobertura-esportiva-em-minas-gerais
"Mineirão apresenta prévia do calendário em reunião do Comitê de Esporte, Cultura e Lazer",Encontro realizado na Cidade Administrativa discutiu a programação de jogos e eventos da temporada,"A Secretaria de Estado de Infraestrutura, Mobilidade e Parcerias (Seinfra) sediou, nessa segunda-feira (10/2), a 5ª reunião do Comitê de Esporte,...","['Infraestrutura', 'Esportes']",2025-02-11 10:50:00-03:00,2025-02,2025,2,10,Manhã,2,304,14,4,https://www.agenciaminas.mg.gov.br/noticia/mineirao-apresenta-previa-do-calendario-em-reuniao-do-comite-de-esporte-cultura-e-lazer
Governo de Minas abre inscrição para os Jogos Escolares de 2025 ,Municípios têm até o dia 11/3 para garantirem participação no maior evento esportivo-social do estado,"Os municípios mineiros já podem se preparar para mais uma edição dos Jogos Escolares de Minas Gerais (Jemg), o maior programa esportivo-escolar do...","['Social', 'Esportes', 'Educação']",2025-02-03 13:50:00-03:00,2025-02,2025,2,13,Tarde,3,504,11,4,https://www.agenciaminas.mg.gov.br/noticia/governo-de-minas-abre-inscricao-para-os-jogos-escolares-de-2025
"Vitória Miranda, atleta patrocinada pela Copasa, é campeã do Australian Open",Mineira de 17 anos é primeira atleta brasileira a conquistar o Grand Slam na categoria Junior,"Copasa / Divulgação Motivo de muito orgulho para os mineiros e brasileiros, a atleta Vitória Miranda, 17 anos, atleta...","['Infraestrutura', 'Esportes']",2025-01-25 11:15:00-03:00,2025-01,2025,1,11,Manhã,2,319,11,4,https://www.agenciaminas.mg.gov.br/noticia/vitoria-miranda-atleta-patrocinada-pela-copasa-e-campea-do-australian-open
Governo de Minas vistoria instalações do programa Minas Urbano em Ipatinga,Política pública de esporte e inclusão social contribui para a ampliação de oportunidades para a juventude,"O Governo de Minas vistoriou, nesta segunda-feira (30/3), as instalações do programa Minas Urbano, em Ipatinga, no Vale do Aço. O governador Mateus...","['Social', 'Governo', 'Esportes', 'Governador']",2026-03-30 15:10:00-03:00,2026-03,2026,3,15,Tarde,4,805,11,4,https://www.agenciaminas.mg.gov.br/noticia/governo-de-minas-vistoria-instalacoes-do-programa-minas-urbano-em-ipatinga
Mineirão moderniza sanitários como parte das ações de preservação do patrimônio ,"Obras contemplam reforma de 185 banheiros, com instalação de 4.608 metros quadrados de pisos em porcelanato, o equivalente a quase dois terços de um campo oficial de futebol","Antes do início do calendário de jogos, o Mineirão aproveitou a pausa entre 2024 e 2025 para se atualizar. Os torcedores que visitarem o estádio...","['Infraestrutura', 'Esportes']",2025-01-17 12:05:00-03:00,2025-01,2025,1,12,Tarde,2,540,11,4,https://www.agenciaminas.mg.gov.br/noticia/mineirao-moderniza-sanitarios-como-parte-das-acoes-de-preservacao-do-patrimonio
Governo de Minas sanciona lei e amplia bolsa de incentivo para atletas e treinadores surdos,Medida busca melhorar o rendimento dos atletas que representam Minas Gerais em competições nacionais e internacionais,"O Governo de Minas sancionou, nesta terça-feira (14/1), o PL 1.376/23, que altera a Lei 20.782/13 para que os atletas e os técnicos surdolímpicos...","['Social', 'Governo', 'Esportes', 'Governador']",2025-01-14 13:30:00-03:00,2025-01,2025,1,13,Tarde,4,734,15,4,https://www.agenciaminas.mg.gov.br/noticia/governo-de-minas-sanciona-lei-e-amplia-bolsa-de-incentivo-para-atletas-e-treinadores-surdos
Rede Minas exibe Superliga de Vôlei a partir desta quinta-feira (9/1),"Emissora exibe as partidas do segundo turno do torneio, das categorias masculina e feminina, e estreia programa dedicado ao esporte","A Rede Minas dá mais um passo marcante na transmissão de jogos de vôlei e traz as partidas do segundo turno da Superliga, das categorias masculina...",['Esportes'],2025-01-08 15:10:00-03:00,2025-01,2025,1,15,Tarde,1,677,11,4,https://www.agenciaminas.mg.gov.br/noticia/rede-minas-exibe-superliga-de-volei-a-partir-desta-quinta-feira-9-1
